Table 1-8:  IPCC Sector Descriptions,,
,,
,Chapter/IPCC Sector,Activities Included
,Energy,"Emissions of all greenhouse gases resulting from stationary and mobile energy activities including fuel combustion and fugitive fuel emissions, and non-energy use of fossil fuels."
,Industrial Processes and Product Use,Emissions resulting from industrial processes and product use of greenhouse gases.
,Agriculture,"Emissions from agricultural activities except fuel combustion, which is addressed under Energy."
,"Land Use, Land-Use Change, and Forestry","Emissions and removals of CO2, and emissions of CH4, and N2O from land use, land-use change and forestry."
,Waste,Emissions from waste management activities.
